62,E,45,P1,PARTIAL,Both,3 Chat and conversations,Delete conversation cascades,Create a chat with messages and an artifact then delete it,The chat messages and chat-owned artifact disappear with no orphaned sidebar item,Yes,"Run the listed visible journey on the exact installed 0.0.40 artifact and inspect state, persistence, errors, and pixels.",NOT RUN,,,,,
63,E,46,P2,PROVEN,Both,3 Chat and conversations,Copy assistant reply,Use the copy action on an assistant message,Pasting into another app yields the expected message text,Yes,"Run the listed visible journey on the exact installed 0.0.40 artifact and inspect state, persistence, errors, and pixels.",NOT RUN,,,,,Real clipboard boundary
64,E,47,P1,PARTIAL,Both,3 Chat and conversations,Regenerate reply,Regenerate an assistant answer,A new answer is produced from the same conversation context without duplicating the user turn,Yes,"Run the listed visible journey on the exact installed 0.0.40 artifact and inspect state, persistence, errors, and pixels.",NOT RUN,,,,,
65,E,48,P0,PARTIAL,Both,3 Chat and conversations,Error clears busy state,Trigger a model or gateway failure during a turn,A useful error appears; spinner and Stop clear; another send can run,Yes,"Run the listed visible journey on the exact installed 0.0.40 artifact and inspect state, persistence, errors, and pixels.",NOT RUN,,,,,
66,E,49,P1,PARTIAL,Both,3 Chat and conversations,Long answer respects configured cap,Raise the response limit and request a long answer,Output can pass the old cap and ends with a clear cutoff state if the new limit is reached,Yes,"Run the listed visible journey on the exact installed 0.0.40 artifact and inspect state, persistence, errors, and pixels.",NOT RUN,,,,,
67,E,50,P2,PARTIAL,Both,3 Chat and conversations,Keyboard and navigation shortcuts,Use Cmd+[ and Cmd+] after visiting several screens,Back and forward navigate through desktop view history without losing screen state,Yes,"Run the listed visible journey on the exact installed 0.0.40 artifact and inspect state, persistence, errors, and pixels.",NOT RUN,,,,,
68,E,51,P0,PARTIAL,Both,4 Projects and artifacts,Create a project,Projects -> create a named project,The project appears and survives navigation and relaunch,Yes,"Run the listed visible journey on the exact installed 0.0.40 artifact and inspect state, persistence, errors, and pixels.",NOT RUN,,,,,
69,E,52,P0,PARTIAL,Both,4 Projects and artifacts,Attach a knowledge document,Open a project and add a supported document,Indexing completes and the document appears once,Yes,"Run the listed visible journey on the exact installed 0.0.40 artifact and inspect state, persistence, errors, and pixels.",NOT RUN,,,,,
70,E,53,P0,PARTIAL,Both,4 Projects and artifacts,Project retrieval is grounded,Start a chat inside the project and ask about the document,The answer uses relevant document content and does not invent an attachment,Yes,"Run the listed visible journey on the exact installed 0.0.40 artifact and inspect state, persistence, errors, and pixels.",NOT RUN,,,,,
71,E,54,P1,PARTIAL,Both,4 Projects and artifacts,New chat inherits project,Create a new chat from inside a project,The conversation is filed under that project and retains its knowledge scope,Yes,"Run the listed visible journey on the exact installed 0.0.40 artifact and inspect state, persistence, errors, and pixels.",NOT RUN,,,,,
72,E,55,P2,PARTIAL,Both,4 Projects and artifacts,Edit project,Change a project's name or details and save,The new values persist in every project surface,Yes,"Run the listed visible journey on the exact installed 0.0.40 artifact and inspect state, persistence, errors, and pixels.",NOT RUN,,,,,
73,E,56,P0,PARTIAL,Both,4 Projects and artifacts,Delete project cascades,Create a project with chat messages documents and artifacts then delete it,Project-owned records disappear without phantom badges or orphaned artifacts,Yes,"Run the listed visible journey on the exact installed 0.0.40 artifact and inspect state, persistence, errors, and pixels.",NOT RUN,,,,,
74,E,57,P1,PARTIAL,Both,4 Projects and artifacts,Text artifact saves and reopens,Generate or save a text artifact from chat then open it from its list,The exact content opens and remains after relaunch,Yes,"Run the listed visible journey on the exact installed 0.0.40 artifact and inspect state, persistence, errors, and pixels.",NOT RUN,,,,,
75,E,58,P1,PARTIAL,Both,4 Projects and artifacts,Image artifact saves and reopens,Generate or save an image artifact then reopen it,The image renders correctly and remains associated with its source,Yes,"Run the listed visible journey on the exact installed 0.0.40 artifact and inspect state, persistence, errors, and pixels.",NOT RUN,,,,,
76,E,59,P2,PROVEN,Both,4 Projects and artifacts,Project list uses desktop layout,Open Projects with enough seeded items to fill the window,Collection uses multiple columns or an appropriate dense master-detail layout,Yes,"Run the listed visible journey on the exact installed 0.0.40 artifact and inspect state, persistence, errors, and pixels.",NOT RUN,,,,,No single 1900px-wide card rows
77,E,60,P1,PARTIAL,Both,4 Projects and artifacts,Unsupported document fails clearly,Attach an unsupported or damaged file,The file is rejected with a specific reason and no half-indexed document remains,Yes,"Run the listed visible journey on the exact installed 0.0.40 artifact and inspect state, persistence, errors, and pixels.",NOT RUN,,,,,
78,E,61,P0,PARTIAL,Both,5 Image and vision,Text prompt generates an image,Activate an image model; use image mode; send a prompt,Progress advances through generation and one image renders,Yes,"Run the listed visible journey on the exact installed 0.0.40 artifact and inspect state, persistence, errors, and pixels.",NOT RUN,,,,,
79,E,62,P0,PARTIAL,Both,5 Image and vision,Image cancellation is scoped,Start image generation in chat A; switch to B; return and stop it,Only A owns the progress and cancellation; B remains idle,Yes,"Run the listed visible journey on the exact installed 0.0.40 artifact and inspect state, persistence, errors, and pixels.",NOT RUN,,,,,
80,E,63,P0,PARTIAL,Both,5 Image and vision,Image cancellation keeps text,Trigger a tool turn that produces text then an image; cancel the image,The text answer remains and is still present after relaunch,Yes,"Run the listed visible journey on the exact installed 0.0.40 artifact and inspect state, persistence, errors, and pixels.",NOT RUN,,,,,
81,E,64,P1,PARTIAL,Both,5 Image and vision,Image settings apply,Change size steps guidance and seed then generate,Output metadata and dimensions reflect the selected values,Yes,"Run the listed visible journey on the exact installed 0.0.40 artifact and inspect state, persistence, errors, and pixels.",NOT RUN,,,,,
82,E,65,P1,PARTIAL,Both,5 Image and vision,Image runtime eviction recovers,Generate an image while the chat model is resident then send a chat prompt,The heavy model handoff completes and chat reloads without a dead server,Yes,"Run the listed visible journey on the exact installed 0.0.40 artifact and inspect state, persistence, errors, and pixels.",NOT RUN,,,,,
83,E,66,P1,PARTIAL,Both,5 Image and vision,Image RAM guard is safe,Choose an image model that exceeds the configured memory budget,Generation is refused with a clear message unless the explicit override is used,Yes,"Run the listed visible journey on the exact installed 0.0.40 artifact and inspect state, persistence, errors, and pixels.",NOT RUN,,,,,Use a disposable test case; do not induce system-wide OOM
84,E,67,P1,PARTIAL,Both,5 Image and vision,Generated image opens,Click a generated image thumbnail,The existing lightbox opens; close and save controls work,Yes,"Run the listed visible journey on the exact installed 0.0.40 artifact and inspect state, persistence, errors, and pixels.",NOT RUN,,,,,
85,E,68,P0,PARTIAL,Both,5 Image and vision,Vision answers about attachment,Activate a vision model; attach an image; ask what it contains,The reply describes the attached image and preserves the text prompt,Yes,"Run the listed visible journey on the exact installed 0.0.40 artifact and inspect state, persistence, errors, and pixels.",NOT RUN,,,,,
86,E,69,P0,PARTIAL,Both,5 Image and vision,Text-only model guards image input,Attach an image while a text-only model is active,The app does not send unsupported image content; it explains or proceeds text-only without engine garbage,Yes,The rendered test still substitutes the preload/API seam.,NOT RUN,,,,,
87,E,70,P1,PARTIAL,Both,5 Image and vision,Damaged image fails safely,Attach a damaged or unsupported image,The app shows a specific error; the conversation remains usable,Yes,"Run the listed visible journey on the exact installed 0.0.40 artifact and inspect state, persistence, errors, and pixels.",NOT RUN,,,,,
88,E,71,P0,PARTIAL,Both,6 Integrations and gateway,Connector can be added,Integrations -> add a reachable connector and complete its setup,It appears once with a truthful connected state,Yes,"Repeat the listed steps on the exact installed 0.0.40 artifact with the real macOS, hardware, network, or external-system boundary.",NOT RUN,,,,,
89,E,72,P1,PARTIAL,Both,6 Integrations and gateway,Connector tools load,Open a connected connector and inspect its tools,Real remote tools are listed with stable enable states,Yes,"Repeat the listed steps on the exact installed 0.0.40 artifact with the real macOS, hardware, network, or external-system boundary.",NOT RUN,,,,,
90,E,73,P0,PARTIAL,Both,6 Integrations and gateway,Connector tool executes,Enable a read-only connector tool and ask chat to use it,A real tool result appears and the final answer uses it,Yes,"Repeat the listed steps on the exact installed 0.0.40 artifact with the real macOS, hardware, network, or external-system boundary.",NOT RUN,,,,,Prefer a reversible read-only tool for release QA
91,E,74,P0,PARTIAL,Both,6 Integrations and gateway,Write tool requires approval,Ask a connector to perform a write action,An approval is required before the external side effect occurs,Yes,"Run the listed visible journey on the exact installed 0.0.40 artifact and inspect state, persistence, errors, and pixels.",NOT RUN,,,,,Release blocker; use a disposable target
92,E,75,P0,PARTIAL,Both,6 Integrations and gateway,Stop prevents connector side effect,Start a turn likely to propose a write then stop before approval or execution,No message event or other write is created,Yes,"Repeat the listed steps on the exact installed 0.0.40 artifact with the real macOS, hardware, network, or external-system boundary.",NOT RUN,,,,,Verify at the external system
93,E,76,P0,PARTIAL,Both,6 Integrations and gateway,Expired connector becomes error,Revoke a connector token then trigger tool discovery,The connector changes to an error or reconnect state instead of silently losing tools,Yes,"Repeat the listed steps on the exact installed 0.0.40 artifact with the real macOS, hardware, network, or external-system boundary.",NOT RUN,,,,,
94,E,77,P1,PARTIAL,Both,6 Integrations and gateway,Dead connector does not hang all tools,Configure several connectors including one unreachable endpoint,Healthy connectors load concurrently and the turn proceeds within the timeout,Yes,"Repeat the listed steps on the exact installed 0.0.40 artifact with the real macOS, hardware, network, or external-system boundary.",NOT RUN,,,,,
95,E,78,P1,PARTIAL,Both,6 Integrations and gateway,Connector delete removes secrets,Delete a connector and relaunch,It stays deleted and its credential cannot still be used,Yes,"Repeat the listed steps on the exact installed 0.0.40 artifact with the real macOS, hardware, network, or external-system boundary.",NOT RUN,,,,,
96,E,79,P0,PROVEN,Both,6 Integrations and gateway,Gateway models endpoint,Open Gateway and call GET /v1/models on 127.0.0.1:7878,A valid OpenAI-compatible response lists the active local model,Yes,"Run the listed visible journey on the exact installed 0.0.40 artifact and inspect state, persistence, errors, and pixels.",NOT RUN,,,,,
97,E,80,P0,PARTIAL,Both,6 Integrations and gateway,Gateway chat streaming,Send an OpenAI-compatible streaming chat request to the local gateway,SSE chunks arrive and terminate cleanly,Yes,"Run the listed visible journey on the exact installed 0.0.40 artifact and inspect state, persistence, errors, and pixels.",NOT RUN,,,,,
98,E,81,P1,PARTIAL,Both,6 Integrations and gateway,Gateway image route,Send a valid image generation request through the gateway,The request reaches the active image runtime and returns a usable image result,Yes,"Only the native `sd-cli` executable is faked; the test verifies its PNG reaches the OpenAI-compatible response and disk, plus the missing-runtime path returns a stable `not_installed` envelope.",NOT RUN,,,,,
99,E,82,P1,PARTIAL,Both,6 Integrations and gateway,Gateway failure envelope,Call a route with no suitable model or invalid input,A stable non-HTML error envelope is returned and the app remains healthy,Yes,"Run the listed visible journey on the exact installed 0.0.40 artifact and inspect state, persistence, errors, and pixels.",NOT RUN,,,,,
100,E,83,P0,PARTIAL,Pro,7 Capture memory and replay,Screen capture permission path,Enable capture and grant macOS Screen Recording permission,New frames begin arriving without an app restart loop,Yes,"Repeat the listed steps on the exact installed 0.0.40 artifact with the real macOS, hardware, network, or external-system boundary.",NOT RUN,,,,,Pro only; mark Core N/A
101,E,84,P0,PARTIAL,Pro,7 Capture memory and replay,Capture disabled means no capture,Turn capture off and work in another app for several minutes,No new replay frames or observations are created,Yes,"Run the listed visible journey on the exact installed 0.0.40 artifact and inspect state, persistence, errors, and pixels.",NOT RUN,,,,,Pro only; privacy gate
102,E,85,P0,PARTIAL,Pro,7 Capture memory and replay,OCR creates searchable memory,Display distinctive text in another app and allow capture processing,Search finds the text or its derived observation,Yes,"ts` drives a normal surface through screenshot, OCR, the real extractor, model transport, and SQLite persistence, then queries the production observation search and retrieves the derived memory; only OS capture/OCR and the native model socket are controlled boundaries.",NOT RUN,,,,,Pro only; allow processing time
103,E,86,P0,PARTIAL,Pro,7 Capture memory and replay,Sensitive or excluded apps are omitted,Use a configured excluded or sensitive application while capture is on,Its content does not appear in replay search or extracted memory,Yes,"Run the listed visible journey on the exact installed 0.0.40 artifact and inspect state, persistence, errors, and pixels.",NOT RUN,,,,,Pro only; privacy gate
104,E,87,P0,PROVEN,Pro,7 Capture memory and replay,Replay timeline renders,Open Replay after seeded or real synthetic capture,Frames appear in chronological order with usable timestamps,Yes,"Run the listed visible journey on the exact installed 0.0.40 artifact and inspect state, persistence, errors, and pixels.",NOT RUN,,,,,Pro only
105,E,88,P1,PARTIAL,Pro,7 Capture memory and replay,Replay playback uses media server,Open a replay session and scrub or play across several moments,Playback responds and media requests succeed on port 7879,Yes,"Run the listed visible journey on the exact installed 0.0.40 artifact and inspect state, persistence, errors, and pixels.",NOT RUN,,,,,Pro only
106,E,89,P1,PROVEN,Pro,7 Capture memory and replay,Replay navigation preserves target,Open a replay hit from Search or Day,Replay opens at the selected moment rather than the start,Yes,"Run the listed visible journey on the exact installed 0.0.40 artifact and inspect state, persistence, errors, and pixels.",NOT RUN,,,,,Pro only
107,E,90,P0,PARTIAL,Pro,7 Capture memory and replay,Unified search finds each source,Search for seeded capture meeting entity and connector records,Each enabled source contributes relevant results,Yes,"Run the listed visible journey on the exact installed 0.0.40 artifact and inspect state, persistence, errors, and pixels.",NOT RUN,,,,,Pro only
108,E,91,P1,PARTIAL,Pro,7 Capture memory and replay,Search filters and sort apply,Toggle source filters and switch Relevant Recent and Match,Results and ordering update without stale rows,Yes,"Run the listed visible journey on the exact installed 0.0.40 artifact and inspect state, persistence, errors, and pixels.",NOT RUN,,,,,Pro only
109,E,92,P1,PARTIAL,Pro,7 Capture memory and replay,Day briefing renders,Open Day on a seeded profile,Priorities meetings suggestions journal time spent and timeline render from real stored data,Yes,"Run the listed visible journey on the exact installed 0.0.40 artifact and inspect state, persistence, errors, and pixels.",NOT RUN,,,,,Pro only
110,E,93,P1,PARTIAL,Pro,7 Capture memory and replay,Day links open correct records,Click a meeting entity action and replay moment from Day,Each opens the intended detail screen and record,Yes,"Run the listed visible journey on the exact installed 0.0.40 artifact and inspect state, persistence, errors, and pixels.",NOT RUN,,,,,Pro only
111,E,95,P0,PARTIAL,Pro,8 Meetings voice and dictation,Meeting detection is truthful,Join and leave a supported call while meeting auto-detect is enabled,Recording starts or prompts according to settings and stops after the call,Yes,ts` drives the production classifier and controller with only active-window/native-recording boundaries controlled.,NOT RUN,,,,,Pro only; real OS boundary
112,E,96,P0,PARTIAL,Pro,8 Meetings voice and dictation,Manual meeting recording,Start and stop a meeting recording from Meetings,One recording is created with sane duration and no lingering mic/system capture,Yes,"Run the listed visible journey on the exact installed 0.0.40 artifact and inspect state, persistence, errors, and pixels.",NOT RUN,,,,,Pro only
113,E,97,P0,PARTIAL,Pro,8 Meetings voice and dictation,Meeting transcript and summary,Record a short synthetic meeting and let processing finish,Transcript matches the audio and summary/action items derive from it,Yes,"Run the listed visible journey on the exact installed 0.0.40 artifact and inspect state, persistence, errors, and pixels.",NOT RUN,,,,,Pro only; do not use private meeting data
114,E,98,P1,PARTIAL,Pro,8 Meetings voice and dictation,Meeting survives relaunch,Quit after a completed recording then reopen,Audio metadata transcript and summary remain accessible,Yes,"Run the listed visible journey on the exact installed 0.0.40 artifact and inspect state, persistence, errors, and pixels.",NOT RUN,,,,,Pro only
115,E,99,P0,PARTIAL,Pro,8 Meetings voice and dictation,Global dictation hotkey,Set Hold Toggle or Both; use Option+Space in another app,Exactly one recording lifecycle occurs according to the selected mode,Yes,"Repeat the listed steps on the exact installed 0.0.40 artifact with the real macOS, hardware, network, or external-system boundary.",NOT RUN,,,,,Pro only; accessibility and microphone permissions required
116,E,100,P0,PARTIAL,Pro,8 Meetings voice and dictation,Dictation pastes at cursor,Place the cursor in TextEdit; dictate a short phrase,The transcript is pasted once at the cursor and the saved recording contains the same text,Yes,"Repeat the listed steps on the exact installed 0.0.40 artifact with the real macOS, hardware, network, or external-system boundary.",NOT RUN,,,,,Pro only; real paste boundary
117,E,101,P1,PARTIAL,Pro,8 Meetings voice and dictation,Dictation paste failure is visible,Remove Accessibility permission and dictate,The transcript is retained and a clear paste-permission error appears,Yes,"Run the listed visible journey on the exact installed 0.0.40 artifact and inspect state, persistence, errors, and pixels.",NOT RUN,,,,,Pro only
118,E,102,P1,PARTIAL,Pro,8 Meetings voice and dictation,Dictation engine selection,Switch between installed Whisper and Parakeet models and dictate,The selected engine runs and produces a transcript without caller-side engine branching,Yes,"Run the listed visible journey on the exact installed 0.0.40 artifact and inspect state, persistence, errors, and pixels.",NOT RUN,,,,,Pro only
119,E,103,P1,PARTIAL,Pro,8 Meetings voice and dictation,Import media for transcription,Drop a supported audio or video file into Voice,Processing finishes and a searchable recording with transcript is created,Yes,"Run the listed visible journey on the exact installed 0.0.40 artifact and inspect state, persistence, errors, and pixels.",NOT RUN,,,,,Pro only
120,E,104,P2,PARTIAL,Pro,8 Meetings voice and dictation,Voice retention settings apply,Set a recording or transcript retention limit and create old test records,Expired records are removed while newer ones remain,Yes,"Run the listed visible journey on the exact installed 0.0.40 artifact and inspect state, persistence, errors, and pixels.",NOT RUN,,,,,Pro only
121,E,105,P1,PARTIAL,Both,8 Meetings voice and dictation,Speak assistant reply,Use the Speak action on an assistant response,Local TTS speaks clean text and does not read markdown syntax,Yes,Only the heavyweight ONNX worker and browser media boundary are controlled.,NOT RUN,,,,,Requires installed TTS model
122,E,106,P0,PARTIAL,Both,8 Meetings voice and dictation,Mic and TTS stop cleanly,Start dictation or speech then stop or navigate away,Native audio activity ends and no background process keeps recording or speaking,Yes,"Run the listed visible journey on the exact installed 0.0.40 artifact and inspect state, persistence, errors, and pixels.",NOT RUN,,,,,
123,E,107,P1,PARTIAL,Pro,9 Entities actions and reflection,Entities are synthesized,Generate synthetic observations about a person project and company,Entities appear once with correct type aliases and supporting observations,Yes,"Run the listed visible journey on the exact installed 0.0.40 artifact and inspect state, persistence, errors, and pixels.",NOT RUN,,,,,Pro only
124,E,108,P1,PARTIAL,Pro,9 Entities actions and reflection,Self mentions are filtered,Seed the user's identity and an observation referring to self,No duplicate external person entity is created for the user,Yes,"Run the listed visible journey on the exact installed 0.0.40 artifact and inspect state, persistence, errors, and pixels.",NOT RUN,,,,,Pro only
125,E,109,P1,PARTIAL,Pro,9 Entities actions and reflection,Entity detail opens,Open an entity from Search Day or the graph,The same entity detail and related evidence appear across entry points,Yes,"Run the listed visible journey on the exact installed 0.0.40 artifact and inspect state, persistence, errors, and pixels.",NOT RUN,,,,,Pro only
126,E,110,P1,PARTIAL,Pro,9 Entities actions and reflection,Entity merge preserves evidence,Merge two duplicate synthetic entities,One entity remains with combined aliases observations and relationships,Yes,"Run the listed visible journey on the exact installed 0.0.40 artifact and inspect state, persistence, errors, and pixels.",NOT RUN,,,,,Pro only; use disposable data
127,E,111,P1,PARTIAL,Pro,9 Entities actions and reflection,Action items are extracted,Process a synthetic observation or meeting containing a commitment,One correctly worded action item appears with its source,Yes,"Run the listed visible journey on the exact installed 0.0.40 artifact and inspect state, persistence, errors, and pixels.",NOT RUN,,,,,Pro only
128,E,112,P0,PARTIAL,Pro,9 Entities actions and reflection,Approval queue gates actions,Open a proposed action then approve or reject it,Rejected actions do nothing; approved actions execute once and record status,Yes,"Run the listed visible journey on the exact installed 0.0.40 artifact and inspect state, persistence, errors, and pixels.",NOT RUN,,,,,Pro only; use a reversible target
129,E,113,P1,PARTIAL,Pro,9 Entities actions and reflection,Action status survives relaunch,Approve reject and dismiss separate synthetic items then reopen,Each status remains correct with no duplicate execution,Yes,"Run the listed visible journey on the exact installed 0.0.40 artifact and inspect state, persistence, errors, and pixels.",NOT RUN,,,,,Pro only
130,E,114,P1,PARTIAL,Pro,9 Entities actions and reflection,Notifications open their target,Click a meeting prep approval or to-do notification,The intended screen and record open; duplicate notifications are not created,Yes,"Repeat the listed steps on the exact installed 0.0.40 artifact with the real macOS, hardware, network, or external-system boundary.",NOT RUN,,,,,Pro only
131,E,115,P1,PARTIAL,Pro,9 Entities actions and reflection,Reflect uses real time ranges,Open daily and weekly Reflect views on seeded data,Totals labels and source breakdowns match the selected date range,Yes,"Run the listed visible journey on the exact installed 0.0.40 artifact and inspect state, persistence, errors, and pixels.",NOT RUN,,,,,Pro only
132,E,116,P0,PARTIAL,Pro,9 Entities actions and reflection,CRM processing tolerates schema upgrades,Open an upgraded profile with older CRM tables,Migrations add missing columns once and CRM screens load without data loss,Yes,"Repeat the listed steps on the exact installed 0.0.40 artifact with the real macOS, hardware, network, or external-system boundary.",NOT RUN,,,,,Pro only; back up the fixture
133,E,117,P0,PARTIAL,Pro,10 Clipboard and vault,Clipboard records text,Copy distinctive text in another app and open Clipboard,One searchable text item appears with the expected content,Yes,"Repeat the listed steps on the exact installed 0.0.40 artifact with the real macOS, hardware, network, or external-system boundary.",NOT RUN,,,,,Pro only
